<Weavers VerifyAssembly="true"
         VerifyIgnoreCodes="0x80131869"
         xmlns:xsi="http://www.w3.org/2001/XMLSchema-instance"
         xsi:noNamespaceSchemaLocation="FodyWeavers.xsd">
  <Anotar.Serilog />
  <Anotar.NLog />
  <Anotar.Custom />
  <Anotar.CommonLogging />
  <AsyncErrorHandler />
  <BasicFodyAddin />
  <Caseless />
  <EmptyConstructor />
  <ExtraConstraints />
  <Equatable />
  <InfoOf />
  <Ionad />
  <Janitor />
  <MethodTimer />
  <ModuleInit />
  <Obsolete />
  <PropertyChanging />
  <PropertyChanged />
  <Validar />
  <Resourcer />
  <Publicize />
  <Virtuosity />
  <Visualize />
</Weavers>